{"candidate_gates":{"by_gate":[{"fail_count":0,"gate":"director_plus","pass_count":20},{"fail_count":0,"gate":"has_upstream_signal","pass_count":20},{"fail_count":0,"gate":"upstream_precedes_job_ad","pass_count":20}],"total_candidates":20},"capture_date":"2026-08-22","capture_version":"pre-hotfix","cooldown":{"companies":null,"eligible_count":null,"input_count":null,"new_evidence_count":null,"observed":null,"returning_count":null,"selected_count":null,"suppressed_count":null},"legacy":null,"operational_status":{"analysis_status":null,"draft_count":null,"draft_error_class":null,"draft_generation_status":null,"notification_channel":null,"notification_status":null,"source_health_status":null},"safe_report_manifest":{"as_of":"2026-08-22","direction":"硬科技组合","run_id":"run_a61b6bceba942157e12aff3e04b2b161"},"schema_version":2,"selected_leads":[{"company":"上海主动科技有限公司","confidence_grade":"B","evidence":[{"event_date":"2026-08-04","event_type":"factory_or_capacity","evidence_url_sha256":"101770f0a9d2f0a3a9316239e8662a7a2b2535052c8eea909aaac888c2709e62","source":"lieyunpro-archives"},{"event_date":"2026-08-04","event_type":"funding","evidence_url_sha256":"101770f0a9d2f0a3a9316239e8662a7a2b2535052c8eea909aaac888c2709e62","source":"lieyunpro-archives"},{"event_date":"2026-08-04","event_type":"new_site_or_entity","evidence_url_sha256":"101770f0a9d2f0a3a9316239e8662a7a2b2535052c8eea909aaac888c2709e62","source":"lieyunpro-archives"},{"event_date":"2026-08-04","event_type":"policy_or_standard","evidence_url_sha256":"101770f0a9d2f0a3a9316239e8662a7a2b2535052c8eea909aaac888c2709e62","source":"lieyunpro-archives"},{"event_date":"2026-08-04","event_type":"regulatory_or_clinical","evidence_url_sha256":"101770f0a9d2f0a3a9316239e8662a7a2b2535052c8eea909aaac888c2709e62","source":"lieyunpro-archives"},{"event_date":"2026-08-04","event_type":"workforce_cluster","evidence_url_sha256":"101770f0a9d2f0a3a9316239e8662a7a2b2535052c8eea909aaac888c2709e62","source":"lieyunpro-archives"},{"event_date":"2026-08-03","event_type":"factory_or_capacity","evidence_url_sha256":"101770f0a9d2f0a3a9316239e8662a7a2b2535052c8eea909aaac888c2709e62","source":"lieyunpro-archives"},{"event_date":"2026-08-03","event_type":"funding","evidence_url_sha256":"101770f0a9d2f0a3a9316239e8662a7a2b2535052c8eea909aaac888c2709e62","source":"lieyunpro-archives"},{"event_date":"2026-08-03","event_type":"new_site_or_entity","evidence_url_sha256":"101770f0a9d2f0a3a9316239e8662a7a2b2535052c8eea909aaac888c2709e62","source":"lieyunpro-archives"},{"event_date":"2026-08-03","event_type":"policy_or_standard","evidence_url_sha256":"101770f0a9d2f0a3a9316239e8662a7a2b2535052c8eea909aaac888c2709e62","source":"lieyunpro-archives"},{"event_date":"2026-08-03","event_type":"regulatory_or_clinical","evidence_url_sha256":"101770f0a9d2f0a3a9316239e8662a7a2b2535052c8eea909aaac888c2709e62","source":"lieyunpro-archives"},{"event_date":"2026-08-03","event_type":"workforce_cluster","evidence_url_sha256":"101770f0a9d2f0a3a9316239e8662a7a2b2535052c8eea909aaac888c2709e62","source":"lieyunpro-archives"},{"event_date":"2026-08-03","event_type":"new_site_or_entity","evidence_url_sha256":"b194f745992513ac1bffa73d27737bb6c0627bea49eae2791f87f3057390258f","source":"pedaily-vcpe-events"},{"event_date":"2026-08-03","event_type":"technical_milestone","evidence_url_sha256":"b194f745992513ac1bffa73d27737bb6c0627bea49eae2791f87f3057390258f","source":"pedaily-vcpe-events"},{"event_date":"2026-08-03","event_type":"factory_or_capacity","evidence_url_sha256":"b194f745992513ac1bffa73d27737bb6c0627bea49eae2791f87f3057390258f","source":"pedaily-vcpe-events"},{"event_date":"2026-08-03","event_type":"workforce_cluster","evidence_url_sha256":"b194f745992513ac1bffa73d27737bb6c0627bea49eae2791f87f3057390258f","source":"pedaily-vcpe-events"},{"event_date":"2026-08-03","event_type":"funding","evidence_url_sha256":"b194f745992513ac1bffa73d27737bb6c0627bea49eae2791f87f3057390258f","source":"pedaily-vcpe-events"},{"event_date":"2026-08-03","event_type":"funding","evidence_url_sha256":"cc0a8af048ae9dfacd2db62ea58ff92f86b9cf572a834f82955ced057caeb700","source":"nbd-vcpe-weekly"}],"gates":{"director_plus":true,"has_upstream_signal":true,"upstream_precedes_job_ad":true},"rank":1,"score":93.0,"target_roles":["区域总经理","注册法规总监","政府事务总监"]},{"company":"上海星环聚能科技有限公司","confidence_grade":"B","evidence":[{"event_date":"2026-08-17","event_type":"funding","evidence_url_sha256":"0f5eeb24043307d3b7d50a5f5c71dcc6fc3258c9d667935a1756233915ae8eac","source":"nbd-vcpe-weekly"},{"event_date":"2026-08-10","event_type":"funding","evidence_url_sha256":"9bbeb53650570f42a8cdf52b6d93d337612338cb80ec341fba8f46cd2b06508a","source":"cnstock-company-channel"},{"event_date":"2026-08-10","event_type":"funding","evidence_url_sha256":"5d0277fca5671724994ff644c76410e5ef6ce6551f8ef6970f6155bed73b1135","source":"pedaily-vcpe-events"},{"event_date":"2026-08-10","event_type":"factory_or_capacity","evidence_url_sha256":"5d0277fca5671724994ff644c76410e5ef6ce6551f8ef6970f6155bed73b1135","source":"pedaily-vcpe-events"},{"event_date":"2026-08-10","event_type":"technical_milestone","evidence_url_sha256":"5d0277fca5671724994ff644c76410e5ef6ce6551f8ef6970f6155bed73b1135","source":"pedaily-vcpe-events"}],"gates":{"director_plus":true,"has_upstream_signal":true,"upstream_precedes_job_ad":true},"rank":2,"score":93.0,"target_roles":["商业化副总裁","产品与战略总监","财务总监"]},{"company":"昆山协鑫光电材料有限公司","confidence_grade":"B","evidence":[{"event_date":"2026-08-04","event_type":"customer_validation","evidence_url_sha256":"ddf8731e2772e5323a637019c60b04cb6bfe226bcb498b88d1056b68a3c38ca4","source":"lieyunpro-archives"},{"event_date":"2026-08-04","event_type":"funding","evidence_url_sha256":"ddf8731e2772e5323a637019c60b04cb6bfe226bcb498b88d1056b68a3c38ca4","source":"lieyunpro-archives"},{"event_date":"2026-08-03","event_type":"factory_or_capacity","evidence_url_sha256":"272350b911fe143216bdb88ca4a8d97523da3a2f5d2288676989b52902bf877e","source":"pedaily-vcpe-events"},{"event_date":"2026-08-03","event_type":"funding","evidence_url_sha256":"ddf8731e2772e5323a637019c60b04cb6bfe226bcb498b88d1056b68a3c38ca4","source":"lieyunpro-archives"},{"event_date":"2026-08-03","event_type":"factory_or_capacity","evidence_url_sha256":"ddf8731e2772e5323a637019c60b04cb6bfe226bcb498b88d1056b68a3c38ca4","source":"lieyunpro-archives"},{"event_date":"2026-08-03","event_type":"partnership","evidence_url_sha256":"ddf8731e2772e5323a637019c60b04cb6bfe226bcb498b88d1056b68a3c38ca4","source":"lieyunpro-archives"},{"event_date":"2026-08-03","event_type":"regulatory_or_clinical","evidence_url_sha256":"ddf8731e2772e5323a637019c60b04cb6bfe226bcb498b88d1056b68a3c38ca4","source":"lieyunpro-archives"}],"gates":{"director_plus":true,"has_upstream_signal":true,"upstream_precedes_job_ad":true},"rank":3,"score":93.0,"target_roles":["客户质量总监","注册法规总监","研发总监"]},{"company":"昉擎科技","confidence_grade":"B","evidence":[{"event_date":"2026-08-03","event_type":"funding","evidence_url_sha256":"0d8a7d6eebb94ca6902547359398bf97f7b6ec058d29168ed1a42ceeddb63940","source":"cnstock-company-channel"},{"event_date":"2026-08-03","event_type":"factory_or_capacity","evidence_url_sha256":"20067b61f67bcc71d4564db6c9742bd7c075d909e2a575d004f29855d690c8d9","source":"pedaily-vcpe-events"},{"event_date":"2026-08-03","event_type":"funding","evidence_url_sha256":"20067b61f67bcc71d4564db6c9742bd7c075d909e2a575d004f29855d690c8d9","source":"pedaily-vcpe-events"},{"event_date":"2026-08-03","event_type":"workforce_cluster","evidence_url_sha256":"20067b61f67bcc71d4564db6c9742bd7c075d909e2a575d004f29855d690c8d9","source":"pedaily-vcpe-events"}],"gates":{"director_plus":true,"has_upstream_signal":true,"upstream_precedes_job_ad":true},"rank":4,"score":93.0,"target_roles":["组织与人才发展总监","研发总监","工厂运营总监"]},{"company":"觅蜂科技","confidence_grade":"B","evidence":[{"event_date":"2026-08-18","event_type":"factory_or_capacity","evidence_url_sha256":"9b9d0115e0617cf51d7bf16a1df0f7f4a2bbf7daefd5ae696df97ab1c3b09625","source":"lieyunpro-archives"},{"event_date":"2026-08-18","event_type":"funding","evidence_url_sha256":"9b9d0115e0617cf51d7bf16a1df0f7f4a2bbf7daefd5ae696df97ab1c3b09625","source":"lieyunpro-archives"},{"event_date":"2026-08-18","event_type":"partnership","evidence_url_sha256":"9b9d0115e0617cf51d7bf16a1df0f7f4a2bbf7daefd5ae696df97ab1c3b09625","source":"lieyunpro-archives"},{"event_date":"2026-08-17","event_type":"funding","evidence_url_sha256":"990607b1a64b57f5c24dff6ac3dacd3c554513b56af976eb8b3c89d3ae4d0b38","source":"pedaily-vcpe-events"},{"event_date":"2026-08-17","event_type":"partnership","evidence_url_sha256":"990607b1a64b57f5c24dff6ac3dacd3c554513b56af976eb8b3c89d3ae4d0b38","source":"pedaily-vcpe-events"},{"event_date":"2026-08-17","event_type":"factory_or_capacity","evidence_url_sha256":"9b9d0115e0617cf51d7bf16a1df0f7f4a2bbf7daefd5ae696df97ab1c3b09625","source":"lieyunpro-archives"},{"event_date":"2026-08-17","event_type":"funding","evidence_url_sha256":"9b9d0115e0617cf51d7bf16a1df0f7f4a2bbf7daefd5ae696df97ab1c3b09625","source":"lieyunpro-archives"},{"event_date":"2026-08-17","event_type":"partnership","evidence_url_sha256":"9b9d0115e0617cf51d7bf16a1df0f7f4a2bbf7daefd5ae696df97ab1c3b09625","source":"lieyunpro-archives"}],"gates":{"director_plus":true,"has_upstream_signal":true,"upstream_precedes_job_ad":true},"rank":5,"score":93.0,"target_roles":["机器人研发总监","量产总监","产业合作总监"]},{"company":"东芯股份","confidence_grade":"B","evidence":[{"event_date":"2026-08-21","event_type":"factory_or_capacity","evidence_url_sha256":"9455f8ba288768a9c0c6d82ab71f743963e25073f088ae59a490bfd7e426ce1a","source":"cls-telegraph"},{"event_date":"2026-08-21","event_type":"customer_validation","evidence_url_sha256":"a4d665a390d4a1a066509bc2b60d5cdc1be977eb9103e593583612fefe2b4335","source":"cnstock-company-channel"},{"event_date":"2026-08-21","event_type":"technical_milestone","evidence_url_sha256":"a4d665a390d4a1a066509bc2b60d5cdc1be977eb9103e593583612fefe2b4335","source":"cnstock-company-channel"}],"gates":{"dire